{
  "schema": "../../../tools/content-schemas/preset.schema.json",
  "id": "hardcore",
  "gameId": "thulla",
  "name": "preset.hardcore.name",
  "description": "preset.hardcore.description",
  "order": 2,
  "overrides": {
    "openingThullaApplies": true,
    "thullaEndsTrick": false,
    "emptyHandLeader": "drawNextPlayer"
  },
  "settings": {
    "turnTimerSeconds": 10
  }
}
